{
  "requestId": "pong-request-watch-every-frame-001",
  "runId": "pong-behavior-watch-wall-bounce-every-frame-run-01",
  "finalStatus": "completed",
  "failureKind": null,
  "manifestPath": "tools/tests/fixtures/pong-testbed/evidence/automation/pong-behavior-watch-wall-bounce-every-frame/evidence-manifest.json",
  "outputDirectory": "res://evidence/automation/pong-behavior-watch-wall-bounce-every-frame",
  "validationResult": {
    "manifestExists": true,
    "artifactRefsChecked": 4,
    "missingArtifacts": [],
    "bundleValid": true,
    "notes": [
      "Manifest and behavior-watch trace artifacts passed validation."
    ],
    "validatedAt": "2026-04-14T00:30:05Z"
  },
  "terminationStatus": "stopped_cleanly",
  "blockedReasons": [],
  "controlPath": "file_broker",
  "completedAt": "2026-04-14T00:30:10Z"
}
